{
    "$schema": "http://json-schema.org/draft-04/schema",
    "maxProperties": 17,
    "minProperties": 17,
    "properties": {
        "buy_currency": {
            "maxLength": 5,
            "minLength": 5,
            "type": [
                "string",
                "null"
            ]
        },
        "buy_price": {
            "exclusiveMaximum": false,
            "exclusiveMinimum": false,
            "maximum": 2400,
            "minimum": 80,
            "type": [
                "null",
                "integer"
            ]
        },
        "color_1": {
            "maxLength": 8,
            "minLength": 3,
            "type": [
                "string"
            ]
        },
        "color_2": {
            "maxLength": 8,
            "minLength": 3,
            "type": [
                "string"
            ]
        },
        "exchange_currency": {
            "maxLength": 10,
            "minLength": 4,
            "type": [
                "string",
                "null"
            ]
        },
        "exchange_price": {
            "exclusiveMaximum": false,
            "exclusiveMinimum": false,
            "maximum": 1600,
            "minimum": 400,
            "type": [
                "null",
                "integer"
            ]
        },
        "hha_points": {
            "exclusiveMaximum": false,
            "exclusiveMinimum": false,
            "maximum": 573,
            "minimum": 51,
            "type": [
                "integer"
            ]
        },
        "internal_id": {
            "exclusiveMaximum": false,
            "exclusiveMinimum": false,
            "maximum": 14850,
            "minimum": 148,
            "type": [
                "integer"
            ]
        },
        "is_craftable": {
            "type": [
                "boolean"
            ]
        },
        "is_equipment": {
            "type": [
                "boolean"
            ]
        },
        "is_unlocked": {
            "type": [
                "boolean"
            ]
        },
        "name": {
            "maxLength": 24,
            "minLength": 3,
            "type": [
                "string"
            ]
        },
        "sell_currency": {
            "maxLength": 5,
            "minLength": 5,
            "type": [
                "string"
            ]
        },
        "sell_price": {
            "exclusiveMaximum": false,
            "exclusiveMinimum": false,
            "maximum": 2500,
            "minimum": 10,
            "type": [
                "integer"
            ]
        },
        "style_1": {
            "maxLength": 8,
            "minLength": 4,
            "type": [
                "string"
            ]
        },
        "style_2": {
            "maxLength": 8,
            "minLength": 4,
            "type": [
                "string"
            ]
        },
        "unique_entry_id": {
            "maxLength": 17,
            "minLength": 17,
            "type": [
                "string"
            ]
        }
    },
    "required": [
        "buy_currency",
        "buy_price",
        "color_1",
        "color_2",
        "exchange_currency",
        "exchange_price",
        "hha_points",
        "internal_id",
        "is_craftable",
        "is_equipment",
        "is_unlocked",
        "name",
        "sell_currency",
        "sell_price",
        "style_1",
        "style_2",
        "unique_entry_id"
    ],
    "title": "ClothingAccessory",
    "type": "object"
}
