[
    {
        "buy_currency": "Bells",
        "buy_price": 3000,
        "color_1": "Black",
        "color_2": "White",
        "exchange_currency": null,
        "exchange_price": null,
        "hha_points": 51,
        "internal_id": 13103,
        "is_craftable": false,
        "is_equipment": false,
        "is_unlocked": true,
        "name": "horizontal-striped wet suit",
        "sell_currency": "Bells",
        "sell_price": 750,
        "style_1": "Active",
        "style_2": "Active",
        "unique_entry_id": "6L2xDvYdeFstLHY86"
    },
    {
        "buy_currency": "Bells",
        "buy_price": 3000,
        "color_1": "Red",
        "color_2": "White",
        "exchange_currency": null,
        "exchange_price": null,
        "hha_points": 51,
        "internal_id": 12986,
        "is_craftable": false,
        "is_equipment": false,
        "is_unlocked": true,
        "name": "horizontal-striped wet suit",
        "sell_currency": "Bells",
        "sell_price": 750,
        "style_1": "Active",
        "style_2": "Active",
        "unique_entry_id": "3TDPbxuAzdDjSSHyA"
    },
    {
        "buy_currency": "Bells",
        "buy_price": 3000,
        "color_1": "Yellow",
        "color_2": "White",
        "exchange_currency": null,
        "exchange_price": null,
        "hha_points": 51,
        "internal_id": 13102,
        "is_craftable": false,
        "is_equipment": false,
        "is_unlocked": true,
        "name": "horizontal-striped wet suit",
        "sell_currency": "Bells",
        "sell_price": 750,
        "style_1": "Active",
        "style_2": "Active",
        "unique_entry_id": "ngqeKA7GqE55ezKww"
    },
    {
        "buy_currency": "Bells",
        "buy_price": 3000,
        "color_1": "Blue",
        "color_2": "White",
        "exchange_currency": null,
        "exchange_price": null,
        "hha_points": 51,
        "internal_id": 13101,
        "is_craftable": false,
        "is_equipment": false,
        "is_unlocked": true,
        "name": "horizontal-striped wet suit",
        "sell_currency": "Bells",
        "sell_price": 750,
        "style_1": "Active",
        "style_2": "Active",
        "unique_entry_id": "hSJxcwRHv7qnKp93f"
    },
    {
        "buy_currency": "Bells",
        "buy_price": 3000,
        "color_1": "Yellow",
        "color_2": "Black",
        "exchange_currency": null,
        "exchange_price": null,
        "hha_points": 51,
        "internal_id": 13099,
        "is_craftable": false,
        "is_equipment": false,
        "is_unlocked": true,
        "name": "leaf-print wet suit",
        "sell_currency": "Bells",
        "sell_price": 750,
        "style_1": "Active",
        "style_2": "Gorgeous",
        "unique_entry_id": "dzprxbw5CzvxNWHt7"
    },
    {
        "buy_currency": "Bells",
        "buy_price": 3000,
        "color_1": "Green",
        "color_2": "Black",
        "exchange_currency": null,
        "exchange_price": null,
        "hha_points": 51,
        "internal_id": 13100,
        "is_craftable": false,
        "is_equipment": false,
        "is_unlocked": true,
        "name": "leaf-print wet suit",
        "sell_currency": "Bells",
        "sell_price": 750,
        "style_1": "Active",
        "style_2": "Gorgeous",
        "unique_entry_id": "3qhdPQngftbrtWgHM"
    },
    {
        "buy_currency": "Bells",
        "buy_price": 3000,
        "color_1": "Aqua",
        "color_2": "Black",
        "exchange_currency": null,
        "exchange_price": null,
        "hha_points": 51,
        "internal_id": 12981,
        "is_craftable": false,
        "is_equipment": false,
        "is_unlocked": true,
        "name": "leaf-print wet suit",
        "sell_currency": "Bells",
        "sell_price": 750,
        "style_1": "Active",
        "style_2": "Gorgeous",
        "unique_entry_id": "mCuc5u3XpnyQqcR8G"
    },
    {
        "buy_currency": "Bells",
        "buy_price": 3000,
        "color_1": "Purple",
        "color_2": "Black",
        "exchange_currency": null,
        "exchange_price": null,
        "hha_points": 51,
        "internal_id": 13098,
        "is_craftable": false,
        "is_equipment": false,
        "is_unlocked": true,
        "name": "leaf-print wet suit",
        "sell_currency": "Bells",
        "sell_price": 750,
        "style_1": "Active",
        "style_2": "Gorgeous",
        "unique_entry_id": "GZwvXzEMwCfhuNTHe"
    },
    {
        "buy_currency": null,
        "buy_price": null,
        "color_1": "Black",
        "color_2": "Green",
        "exchange_currency": "Nook Miles",
        "exchange_price": 800,
        "hha_points": 151,
        "internal_id": 12970,
        "is_craftable": false,
        "is_equipment": false,
        "is_unlocked": true,
        "name": "Nook Inc. wet suit",
        "sell_currency": "Bells",
        "sell_price": 4000,
        "style_1": "Active",
        "style_2": "Simple",
        "unique_entry_id": "jjwdLhmb3X42fvtHa"
    }
]
